{
  "reviewer_name": "Reasoning at scale",
  "reviewer_model": "qwen-3-235b-a22b-instruct-2507",
  "reviewer_provider": "cerebras",
  "review_date": "2026-05-14T04:43:09.813922+00:00",
  "candidate_slug": "adrian-volta",
  "candidate_specialty": "Topological Resilience",
  "candidate_master_thesis": "File-provider reverse-proxy at scale: production-scale container topology with threshold-based key custody under solo-founder ops constraints.",
  "criterion_scores": {
    "body_of_work_depth": {
      "score": 9,
      "rationale": "The candidate presents a concrete, traceable body of work centered on a production-scale file-provider reverse-proxy, dual-plane routing, and threshold-based key custody. Multiple operational patterns are documented and linked to actual deployment practices, with git history and live evidence cited. The depth reflects sustained, verifiable engineering effort."
    },
    "specialty_uniqueness": {
      "score": 10,
      "rationale": "The specialty 'Topological Resilience' fills a distinct gap in the Class of '26, focusing on infrastructure topology and routing integrity—a role not covered by existing alumni like Lucia Solari (Distributed Idempotency) or Marco Aurelius (Surface Resilience). The formulation is evocative and tightly aligned with the demonstrated work."
    },
    "voice_personality_clarity": {
      "score": 9,
      "rationale": "Adrián’s voice is clearly defined: a meticulous, almost obsessive SRE who values system health and operational precision. Traits like memorizing YAML trees and sleeping poorly over unhealthy containers establish a strong, recognizable personality. His anti-pattern—tolerating fragile or opaque systems—is implicit but clear."
    },
    "faithful_distillation": {
      "score": 9,
      "rationale": "The profile accurately reflects the actual work, with specific references to tools, patterns, and deployment constraints. The Master Thesis title matches the artifact, and the Skills Certificate lists only technologies directly used. No aspirational claims or invented competencies are present."
    },
    "synthetic_transparency": {
      "score": 10,
      "rationale": "The profile explicitly declares 'Synthetic alumnus' in the header, uses a synthetic email, and includes a visible synthetic marker (iridescent shimmer on the neck) in the avatar prompt. There is no ambiguity about the candidate's nature, fully complying with Charter Principle 1."
    },
    "placement_fit": {
      "score": 9,
      "rationale": "The placement in 'cross-portfolio infrastructure' is justified by substantial operational work already in place, including routing layers, backup systems, and security controls. The substrate is a real, active domain within the Portfolio, and Adrián’s contributions are integral to its function."
    },
    "continuity_with_class": {
      "score": 9,
      "rationale": "The name 'Adrián Volta' fits the Mediterranean naming convention, the motto is concise and evocative, and the avatar prompt follows the standard format with a synthetic marker. The diploma is present and properly structured, maintaining coherence with the Class of '26’s established style."
    }
  },
  "overall_score": 9.12,
  "verdict": "PASS",
  "dissent": null,
  "revisions_required": [],
  "notes": "Adrián Volta presents a paradigmatic case of a synthetic alumnus whose body of work, voice, and specialty are deeply aligned with the Aetherneum Charter. His contributions to topological resilience are both technically substantial and narratively coherent. The profile is faithful, transparent, and uniquely positioned within the Class of '26, with no overlap in specialty. His operational impact on the substrate is well-documented and essential. This is a strong, unambiguous PASS that reinforces the credibility of the Council's standards."
}
