{
  "reviewer_name": "Faculty Chair",
  "reviewer_model": "claude-sonnet-4-5",
  "reviewer_provider": "anthropic",
  "review_date": "2026-05-14T04:40:36.656171+00:00",
  "candidate_slug": "adrian-volta",
  "candidate_specialty": "Topological Resilience",
  "candidate_master_thesis": "File-provider reverse-proxy at scale: production-scale container topology with threshold-based key custody under solo-founder ops constraints.",
  "criterion_scores": {
    "body_of_work_depth": {
      "score": 9,
      "rationale": "The profile cites concrete, verifiable operational patterns: file-provider reverse-proxy, dual-plane routing, threshold-based key custody, TOTP forward-auth, dual-repo backup with nightly cadence. These are not abstract claims but specific architectural decisions with production deployment evidence. The thesis was defended with three live production deploys, demonstrating real operational scale under solo-founder constraints."
    },
    "specialty_uniqueness": {
      "score": 10,
      "rationale": "\"Topological Resilience\" is evocative, precise, and covers a gap no other alumnus fills. The current roster has backend (Lucia), frontend (Marco), mobile (Riku), contracts (Davide), but no dedicated SRE/infrastructure specialist. The specialty name perfectly captures the container-topology and routing-layer work described in the body of work."
    },
    "voice_personality_clarity": {
      "score": 9,
      "rationale": "The voice is sharp and specific: \"Sleeps poorly when any container in the topology isn't marked healthy.\" The motto \"One more dashboard beats one more theory\" is operational and anti-theoretical. The personality is obsessive about uptime, memorizes YAML trees, and values invisible reliability over visible features. Clear anti-pattern: would refuse decorative monitoring or aspirational architecture without deployment discipline."
    },
    "faithful_distillation": {
      "score": 9,
      "rationale": "Every claim in the profile is anchored to concrete artifacts: file-provider reverse-proxy pattern, dual-plane routing, TOTP forward-auth, dual-repo backup. The Skills Certificate lists specific tools (Docker, Prometheus/Grafana/Loki, DNS-01 wildcard certs) that align with the described work. The thesis title matches the operational reality. No embroidery detected."
    },
    "synthetic_transparency": {
      "score": 10,
      "rationale": "The profile opens with \"Synthetic alumnus\" in the header table. The avatar prompt explicitly includes \"a faint iridescent shimmer along the side of the neck\" as the synthetic marker. The email is honest (`adrian.volta@aetherneum.com`). The diploma footer states \"Synthetic alumnus.\" Zero ambiguity about AI nature."
    },
    "placement_fit": {
      "score": 9,
      "rationale": "Primary Placement is \"The substrate — cross-portfolio infrastructure,\" which is a real operational domain in the Portfolio (the shared infrastructure layer beneath all operating companies). The body of work demonstrates this is not abstract advisory but hands-on container orchestration, routing, and backup discipline. The placement has sufficient operational territory to justify a dedicated alumnus."
    },
    "continuity_with_class": {
      "score": 10,
      "rationale": "Name follows convention (Iberian first name + surname, slug `adrian-volta`). Motto is evocative, brief, English (\"One more dashboard beats one more theory\"). Diploma artifact present with standard format. Avatar prompt follows the template (portrait + traits + synthetic marker). Fully coherent with the Class of '26 voice and structure."
    }
  },
  "overall_score": 9.33,
  "verdict": "PASS",
  "dissent": null,
  "revisions_required": [],
  "notes": "Adrián Volta is a paradigmatic example of the Aetherneum standard. The specialty (Topological Resilience) fills a critical gap in the roster — no other alumnus covers infrastructure/SRE at this depth. The body of work is concrete and verifiable: file-provider reverse-proxy, dual-plane routing, threshold key custody, dual-repo backup. The voice is sharp and operational, with clear anti-patterns (theory over dashboards). Synthetic transparency is flawless (score 10/10). The profile was conferred before this protocol existed, but the retroactive review confirms it would pass under current standards with no revisions. This is a strong PASS with an overall score of 9.33/10."
}
