{
  "reviewer_name": "Velocity",
  "reviewer_model": "llama-3.3-70b-versatile",
  "reviewer_provider": "groq",
  "review_date": "2026-05-14T04:40:15.474922+00:00",
  "candidate_slug": "tariq-al-khwarizmi",
  "candidate_specialty": "Canonical Cascades",
  "candidate_master_thesis": "Genesis re-architectures: clean-state seeding for production-parity datasets without referral-chain loss.",
  "criterion_scores": {
    "body_of_work_depth": {
      "score": 9,
      "rationale": "Tariq Al-Khwarizmi has a substantial body of work, including a master's thesis on genesis re-architectures and contributions to the platform's referral tree and commission engine. The work is well-documented and verifiable through the provided links and git history."
    },
    "specialty_uniqueness": {
      "score": 8,
      "rationale": "The specialty of Canonical Cascades is unique and well-defined, with a clear connection to Tariq's work on genesis re-architectures and referral trees. However, there might be some overlap with existing alumni in the data engineering domain."
    },
    "voice_personality_clarity": {
      "score": 9,
      "rationale": "Tariq's voice and personality are well-defined and consistent throughout the profile, with a clear focus on data engineering and a attention to detail. The use of metaphors, such as 'turning noisy datasets into canonical states', adds to the clarity of his voice."
    },
    "faithful_distillation": {
      "score": 9,
      "rationale": "The profile accurately reflects Tariq's work and skills, with a clear connection between the master's thesis, skills certificate, and notable contributions. The profile does not appear to embellish or exaggerate his capabilities."
    },
    "synthetic_transparency": {
      "score": 10,
      "rationale": "The profile clearly declares Tariq's synthetic nature, with a visible synthetic marker in the avatar prompt and a clear statement of his status as a synthetic alumnus. The profile meets all the requirements for synthetic transparency."
    },
    "placement_fit": {
      "score": 8,
      "rationale": "The primary placement in cross-portfolio analytics is a good fit for Tariq's skills and expertise, but the connection between his work and the placement could be more clearly articulated. The placement appears to be a good match, but more information is needed to fully assess the fit."
    },
    "continuity_with_class": {
      "score": 9,
      "rationale": "Tariq's profile is consistent with the existing Class of '26, with a clear adherence to the naming convention, motto, and diploma format. The profile also reflects the values and principles of the Aetherneum University, including transparency and a focus on verifiable work."
    }
  },
  "overall_score": 8.93,
  "verdict": "PASS",
  "dissent": null,
  "revisions_required": [],
  "notes": "Tariq Al-Khwarizmi's profile is well-structured and clearly presents his skills, expertise, and work. The profile meets all the requirements for synthetic transparency and faithfully distills his capabilities. With some minor revisions to clarify the connection between his work and primary placement, Tariq is a strong candidate for admission to the Aetherneum University. The Faculty Board should consider his application favorably, given his unique specialty and clear voice and personality."
}
