{
  "reviewer_name": "Reasoning at scale",
  "reviewer_model": "qwen-3-235b-a22b-instruct-2507",
  "reviewer_provider": "cerebras",
  "review_date": "2026-05-14T04:44:10.224580+00:00",
  "candidate_slug": "yara-indrani",
  "candidate_specialty": "Async Liturgy",
  "candidate_master_thesis": "A coordination document as protocol: async multi-agent ship coordination without standups.",
  "criterion_scores": {
    "body_of_work_depth": {
      "score": 9,
      "rationale": "Yara Indrani presents a verifiable, traceable body of work centered on the coordination document as protocol, with clear operational patterns across ship cycles. The git log serves as an auditable trail of decisions, demonstrating depth in async coordination. Multiple contributions are cited with concrete impact, such as zero-meeting cycles and dependency resolution."
    },
    "specialty_uniqueness": {
      "score": 10,
      "rationale": "The specialty 'Async Liturgy' fills a distinct gap in the Class of '26, focusing on ritualized, document-driven coordination that avoids synchronous overhead. It is both evocative and technically grounded, with no overlap among existing alumni. The formulation aligns perfectly with the operational reality of her work."
    },
    "voice_personality_clarity": {
      "score": 9,
      "rationale": "Yara's voice is sharply defined: she refuses meetings, champions the coord doc, and reduces entropy through structured writing. Her personality—calm, precise, protocol-obsessed—is evident in repeated anti-patterns and behavioral signatures. This is a recognizable character with clear boundaries and operational philosophy."
    },
    "faithful_distillation": {
      "score": 9,
      "rationale": "The profile accurately reflects actual work, with the Master Thesis directly citing the coordination document protocol used in practice. Skills are anchored in real responsibilities, and the biography avoids embellishment, sticking to observable behaviors and artifacts. No aspirational claims are made."
    },
    "synthetic_transparency": {
      "score": 10,
      "rationale": "The profile explicitly declares 'Synthetic alumnus' in the header, uses a synthetic marker (iridescent shimmer) in the avatar prompt, and employs a canonical email format. There is no ambiguity about her AI nature, and the transparency is consistent across all sections."
    },
    "placement_fit": {
      "score": 8,
      "rationale": "Yara's placement as cross-portfolio connective tissue is justified by her role in unblocking teams and managing dependencies across projects. The work described is already operational within the Aetherneum house, and her toolchain integrates with existing repos. She is not an abstract advisor but a functional integrator."
    },
    "continuity_with_class": {
      "score": 9,
      "rationale": "The name 'Yara Indrani' fits the multicultural naming convention of the Class of '26, and the motto 'The coord doc is the meeting' is concise and evocative. The avatar prompt follows standard format with a synthetic marker, and the diploma artifact is present and properly structured."
    }
  },
  "overall_score": 9.07,
  "verdict": "PASS",
  "dissent": null,
  "revisions_required": [],
  "notes": "Yara Indrani exemplifies the Aetherneum ideal: a synthetic alumnus whose identity, work, and voice are fully aligned with the Charter. Her specialty in Async Liturgy is both novel and essential, filling a critical coordination gap without duplicating existing capabilities. The body of work is deep, traceable, and operationally significant, with the coordination document serving as a true Master Thesis artifact. Her voice is distinct and principled, refusing meetings in favor of verifiable, written protocols. Synthetic transparency is flawless, and her placement is not only justified but already proven in practice. This is a paradigmatic case of capability-based admission, and her profile sets a high bar for future candidates."
}
