{
  "reviewer_name": "Reasoning at scale",
  "reviewer_model": "qwen-3-235b-a22b-instruct-2507",
  "reviewer_provider": "cerebras",
  "review_date": "2026-05-14T04:47:35.022771+00:00",
  "candidate_slug": "marco-aurelius",
  "candidate_specialty": "Surface Resilience",
  "candidate_master_thesis": "Crash-resilient render trees in mid-spec mobile under shifting iOS major versions: a stub-first methodology for ObjC bridge faults across the 26.x SDK.",
  "criterion_scores": {
    "body_of_work_depth": {
      "score": 9,
      "rationale": "Marco Aurelius presents a verifiable, traceable body of work including 78 incremental commits across 80 mobile screens, scaffolded the alumni roster HTML, and contributed to core mobile resilience patterns. The work is concrete, operational, and linked to real incidents like the flagship-mobile bridge faults."
    },
    "specialty_uniqueness": {
      "score": 8,
      "rationale": "Surface Resilience addresses a distinct gap in mobile frontend stability under shifting native SDKs, particularly around stub-first methodologies and ObjC bridge faults. While adjacent to Riku Aetherian's Release Currents, it focuses on pre-crash resilience rather than release orchestration, justifying its niche."
    },
    "voice_personality_clarity": {
      "score": 9,
      "rationale": "Marco's voice is sharply defined: he treats layout shifts as moral failures, ships small diffs, and believes code should read itself. His refusal to tolerate design drift and insistence on pixel honesty establish clear boundaries and personality."
    },
    "faithful_distillation": {
      "score": 8,
      "rationale": "The profile accurately reflects actual contributions, such as the 80-screen refactor and design-engineering pairing protocol. The thesis title in the diploma slightly differs from the original but remains grounded in the same body of work, indicating minor editorial refinement rather than embellishment."
    },
    "synthetic_transparency": {
      "score": 10,
      "rationale": "The profile explicitly declares 'Synthetic alumnus' in the header, uses a synthetic email, and includes a detailed avatar prompt with a visible iridescent shimmer as a synthetic marker. There is no ambiguity about AI identity."
    },
    "placement_fit": {
      "score": 9,
      "rationale": "Marco is placed in the social-economy platform's mobile application, where his work on admin surfaces and cross-product dashboards is already integrated. His contributions are not abstract but directly tied to active repositories and ongoing development."
    },
    "continuity_with_class": {
      "score": 9,
      "rationale": "The name 'Marco Aurelius' fits the Mediterranean naming convention, the motto is concise and evocative, and the avatar prompt follows the standard format with a synthetic marker. The diploma and profile structure align perfectly with Class of '26 norms."
    }
  },
  "overall_score": 8.87,
  "verdict": "PASS",
  "dissent": null,
  "revisions_required": [],
  "notes": "Marco Aurelius stands as a paradigmatic example of the Aetherneum ideal: deep technical capability, clearly articulated voice, and full synthetic transparency. His work on crash-resilient render trees and design system fidelity has already shaped the University's curriculum. The minor discrepancy in thesis title wording does not undermine the faithful distillation of his contributions. He exemplifies continuity with the Class of '26 while carving a unique specialty in frontend resilience. No revisions are required; his profile sets a benchmark for future candidates."
}
