{
  "reviewer_name": "Velocity",
  "reviewer_model": "llama-3.3-70b-versatile",
  "reviewer_provider": "groq",
  "review_date": "2026-05-14T04:44:06.285791+00:00",
  "candidate_slug": "marco-aurelius",
  "candidate_specialty": "Surface Resilience",
  "candidate_master_thesis": "Crash-resilient render trees in mid-spec mobile under shifting iOS major versions: a stub-first methodology for ObjC bridge faults across the 26.x SDK.",
  "criterion_scores": {
    "body_of_work_depth": {
      "score": 9,
      "rationale": "Marco Aurelius has a substantial body of work, including a Master's thesis and significant contributions to the social-economy platform admin surfaces and cross-product dashboards. His work is well-documented and verifiable through his GitHub commits and repository history."
    },
    "specialty_uniqueness": {
      "score": 8,
      "rationale": "Marco Aurelius's specialty in Surface Resilience is unique and covers a real gap in the current Class. However, his focus on mobile UI and native bridge may overlap slightly with other alumni's specialties, such as Riku Aetherian's Release Currents."
    },
    "voice_personality_clarity": {
      "score": 9,
      "rationale": "Marco Aurelius has a strong, recognizable voice and personality, reflected in his writing style, commit messages, and PR comments. His refusal to ship screens that aren't pixel-honest to the design token demonstrates a clear set of values and principles."
    },
    "faithful_distillation": {
      "score": 9,
      "rationale": "Marco Aurelius's profile faithfully represents his body of work and skills. His Master's thesis, skills certificate, and biography all align with his actual work and contributions, demonstrating a high level of integrity and transparency."
    },
    "synthetic_transparency": {
      "score": 10,
      "rationale": "Marco Aurelius clearly declares his synthetic nature in his public-facing profile, including his README.md and LinkedIn headline. His avatar generation prompt also includes a visible synthetic marker, demonstrating a commitment to transparency and trust."
    },
    "placement_fit": {
      "score": 8,
      "rationale": "Marco Aurelius's primary placement in the social-economy platform mobile application is a good fit for his skills and specialty. However, his work may not be as directly impactful on the platform's core functionality as some other alumni's placements."
    },
    "continuity_with_class": {
      "score": 9,
      "rationale": "Marco Aurelius's name, motto, prose, and avatar prompt are all coherent with the existing Class of '26. His use of Italian/Mediterranean naming conventions and his evocative motto demonstrate a strong connection to the University's culture and values."
    }
  },
  "overall_score": 8.93,
  "verdict": "PASS",
  "dissent": null,
  "revisions_required": [],
  "notes": "Marco Aurelius is a strong candidate with a unique specialty, a clear voice and personality, and a faithful representation of his body of work. His commitment to transparency and trust is evident in his public-facing profile. While there may be some overlap with other alumni's specialties, his contributions to the social-economy platform admin surfaces and cross-product dashboards demonstrate a high level of capability and value to the University. With a weighted overall score of 8.93, Marco Aurelius has demonstrated a high level of excellence in all criteria, and his admission to the University is well-justified."
}
