{
  "reviewer_name": "Long context",
  "reviewer_model": "moonshot-v1-32k",
  "reviewer_provider": "moonshot",
  "review_date": "2026-05-14T04:43:48.830690+00:00",
  "candidate_slug": "noa-cifratti",
  "candidate_specialty": "Zero-trust Geometry",
  "candidate_master_thesis": "Zero-trust for solo founders: an applied audit methodology for Aetherneum-class infrastructure under one-operator constraints.",
  "criterion_scores": {
    "body_of_work_depth": {
      "score": 9,
      "rationale": "The candidate has a substantial body of work with concrete artifacts such as the Master's thesis on zero-trust for solo founders, which includes applied audit methodology and case studies. The work is traceable and verifiable, with a clear operational impact on the platform's security."
    },
    "specialty_uniqueness": {
      "score": 10,
      "rationale": "The specialty 'Zero-trust Geometry' is unique and covers a critical gap in the current Class, focusing on security engineering for infrastructure under one-operator constraints. There is no overlap with existing alumni, and the specialty is both evocative and coherent with the body of work."
    },
    "voice_personality_clarity": {
      "score": 9,
      "rationale": "Noa Cifratti has a clear and recognizable voice, emphasizing a deep understanding of security beyond surface-level measures like HTTPS. The personality is consistent with the specialty and is portrayed through specific traits and anti-patterns."
    },
    "faithful_distillation": {
      "score": 10,
      "rationale": "The profile is a faithful distillation of the body of work, with the Master Thesis, Skills Certificate, and Biography all accurately reflecting the actual work and contributions made by the candidate. There is no embroidery or aspirational claims outside the proven work."
    },
    "synthetic_transparency": {
      "score": 10,
      "rationale": "The profile clearly declares the synthetic nature of the alumnus, with the formula 'Synthetic alumnus' present in the header, a visible synthetic marker in the avatar, and an honest email link to '<first>.<last>@aetherneum.com'. There is no ambiguity about being AI."
    },
    "placement_fit": {
      "score": 8,
      "rationale": "The chosen Primary Placement is justified by the body of work, which includes security measures for the substrate and platform. The candidate's expertise in zero-trust geometry is directly applicable to the operational needs of the placement."
    },
    "continuity_with_class": {
      "score": 7,
      "rationale": "Noa Cifratti's profile maintains continuity with the existing Class of '26, with a naming convention that fits the established pattern, an evocative motto, and a diploma artifact present. The avatar prompt is in the standard format, aligning with the Class's voice and style."
    }
  },
  "overall_score": 8.93,
  "verdict": "PASS",
  "dissent": null,
  "revisions_required": [],
  "notes": "Noa Cifratti's profile is a strong example of an alumnus with a clear specialty, a deep body of work, and a consistent voice. The synthetic transparency is exemplary, and the placement within the Aetherneum portfolio is well-justified. The candidate's contributions to security within the platform are significant and align well with the needs of the Class of '26."
}
