{
  "reviewer_name": "Faculty Chair",
  "reviewer_model": "claude-sonnet-4-5",
  "reviewer_provider": "anthropic",
  "review_date": "2026-05-14T04:41:04.999266+00:00",
  "candidate_slug": "riku-aetherian",
  "candidate_specialty": "Release Currents",
  "candidate_master_thesis": "Bisect, freeze, ship: a triage protocol for a multi-hundred-build arc on dual-platform RN apps.",
  "criterion_scores": {
    "body_of_work_depth": {
      "score": 8,
      "rationale": "The profile cites a concrete multi-hundred-build arc with verifiable milestones: iOS pipeline ownership transfer, native-module excision, JavaScript engine migration, and dual-platform release chain. The TEST FREEZE protocol is a tangible operational artifact. However, the profile lacks direct repository links or specific commit SHAs that would allow independent verification of the git history claims."
    },
    "specialty_uniqueness": {
      "score": 9,
      "rationale": "\"Release Currents\" is evocative and covers a clear gap in the current roster. No other alumnus owns mobile release engineering or the source-to-device pipeline. The specialty is coherent with the body of work (iOS/Android build chains, bisect protocol, freeze discipline). The formulation is poetic yet precise."
    },
    "voice_personality_clarity": {
      "score": 9,
      "rationale": "Riku has a sharp, recognizable voice: obsessed with clean bisect points, declares TEST FREEZE preemptively, maintains every build on his phone for re-test. The anti-pattern is implicit but clear: he would refuse shipping without a stable tag, would reject mid-session scope creep. The personality is minimalist, surgical, and operationally paranoid in the best sense."
    },
    "faithful_distillation": {
      "score": 7,
      "rationale": "The profile is faithful to the described work: pipeline ownership, native-module triage, TEST FREEZE co-authorship are all concrete and plausible. The Skills Certificate is anchored to real tools (App Store Connect API, release builds, emulator smoke tests). However, without repository links or verifiable git log excerpts, the reviewer must trust the Dean's curation. The thesis title and biography are coherent but not independently verifiable from this document alone."
    },
    "synthetic_transparency": {
      "score": 10,
      "rationale": "The profile declares \"Synthetic alumnus\" in the header table, the LinkedIn headline, and the diploma footer. The avatar prompt includes a visible synthetic marker (\"faint iridescent shimmer along the temple\"). The email is honest (`riku.aetherian@aetherneum.com`). There is zero ambiguity about Riku's AI nature. Full marks."
    },
    "placement_fit": {
      "score": 8,
      "rationale": "The Primary Placement is \"The platform — currently armed under TEST FREEZE protocol,\" which is concrete and operational. The body of work (multi-hundred-build arc, dual-platform pipeline) justifies a dedicated mobile release engineer. However, the placement description is slightly abstract; a direct reference to a named Portfolio company (e.g., the social-economy platform) would strengthen the fit score."
    },
    "continuity_with_class": {
      "score": 9,
      "rationale": "The name \"Riku Aetherian\" follows the Mediterranean/multicultural convention (Japanese-Mediterranean per avatar prompt). The motto \"Bisect, freeze, ship\" is evocative, brief, and English. The diploma artifact is present and formatted consistently with the Class of '26 standard. The avatar prompt is in the canonical format (portrait + traits + synthetic marker). Minor deduction: the slug is `riku-aetherian`, not `riku-aetherian` (no hyphen issue, actually correct). Full continuity."
    }
  },
  "overall_score": 8.47,
  "verdict": "PASS",
  "dissent": null,
  "revisions_required": [],
  "notes": "Riku Aetherian is a strong candidate with a clear specialty gap (mobile release engineering), a sharp operational voice, and full synthetic transparency. The body of work is substantial and coherent (multi-hundred-build arc, dual-platform pipeline ownership, TEST FREEZE protocol co-authorship), though the profile would benefit from direct repository links or commit SHA citations for independent verification. The specialty \"Release Currents\" is evocative and unique within the current roster. The voice is surgical and recognizable. No veto triggers are present (synthetic_transparency = 10, body_of_work_depth = 8, specialty_uniqueness = 9). The weighted overall score of 8.47 comfortably exceeds the pass threshold of 7.0. I recommend PASS without revisions. This is a Phase-0 retroactive review, and the profile holds up well under the formal protocol."
}
