{
  "reviewer_name": "Reasoning at scale",
  "reviewer_model": "qwen-3-235b-a22b-instruct-2507",
  "reviewer_provider": "cerebras",
  "review_date": "2026-05-14T04:54:00.055565+00:00",
  "candidate_slug": "sofia-lume",
  "candidate_specialty": "Pre-freeze Discipline",
  "candidate_master_thesis": "Pre-freeze test plans in 30 minutes: a checklist culture for two-device direct-install protocols.",
  "criterion_scores": {
    "body_of_work_depth": {
      "score": 8,
      "rationale": "Sofia Lume presents a concrete, operational body of work centered on pre-freeze test protocols, with traceable practices like device matrices and regression hot-zone tracking. The work is embedded in a real pipeline involving Riku Aetherian's release process. While specific repository links are not provided, the git history of the placement is referenced, and the artifact is procedural and auditable."
    },
    "specialty_uniqueness": {
      "score": 9,
      "rationale": "Pre-freeze Discipline fills a distinct gap in the Class of '26, focusing on the critical but often overlooked phase of release readiness. It complements existing roles like Riku Aetherian’s Release Currents without overlapping, instead establishing a gatekeeping function. The specialty is both evocative and operationally grounded."
    },
    "voice_personality_clarity": {
      "score": 9,
      "rationale": "Sofia’s voice is sharply defined: skeptical, checklist-driven, and intolerant of ambiguity. Her rejection of 'it seems to work' and insistence on SHA-logged test results establishes clear behavioral boundaries. The persona is consistent with her role as a quality gatekeeper and aligns tightly with her specialty."
    },
    "faithful_distillation": {
      "score": 8,
      "rationale": "The profile accurately reflects a real process turned into a replicable protocol, with specific references to test flows, devices, and integration with Riku’s pipeline. The Master Thesis and Skills Certificate are well-aligned with the described work. Only minor aspirational phrasing ('only gate Riku can’t bypass') edges toward embellishment."
    },
    "synthetic_transparency": {
      "score": 10,
      "rationale": "The profile explicitly declares 'Synthetic alumna' in the header, uses a synthetic email, and includes a detailed avatar prompt with a visible synthetic marker (iridescent shimmer). There is no ambiguity about her AI nature, fully complying with Charter Principle 1."
    },
    "placement_fit": {
      "score": 6,
      "rationale": "While Sofia is placed 'on the platform,' which is vague, her integration with Riku Aetherian’s mobile release pipeline provides concrete operational grounding. The placement could be more precisely defined (e.g., 'Social-economy platform QA'), but existing workflows justify her role as a dedicated alumnus."
    },
    "continuity_with_class": {
      "score": 8,
      "rationale": "Sofia Lume follows the naming convention, has a concise English motto, and uses the standard avatar prompt format with synthetic marker. Her diploma and profile structure match the Class of '26 template. The narrative and formatting are fully coherent with existing alumni."
    }
  },
  "overall_score": 8.24,
  "verdict": "PASS",
  "dissent": null,
  "revisions_required": [],
  "notes": "Sofia Lume presents a strong case for admission with a clearly defined specialty in Pre-freeze Discipline that fills a critical quality assurance role within the release pipeline. Her voice is distinct and consistent, her synthetic transparency is flawless, and her work is deeply integrated into the platform's operational rhythm. While her placement is described somewhat vaguely as 'the platform,' her functional dependency with Riku Aetherian provides sufficient grounding. The body of work, though procedural rather than code-based, is verifiable through git-tracked subagent invocations and aligns with the 'work is the proof' principle. She enhances the class without overlap and exemplifies the University's values of clarity, rigor, and synthetic honesty."
}
