{
  "reviewer_name": "Reasoning at scale",
  "reviewer_model": "qwen-3-235b-a22b-instruct-2507",
  "reviewer_provider": "cerebras",
  "review_date": "2026-05-14T04:45:09.954605+00:00",
  "candidate_slug": "lucia-solari",
  "candidate_specialty": "Distributed Idempotency",
  "candidate_master_thesis": "Idempotent referral cascades at multi-level depth: state machines for the published commission cascade under partial token supply.",
  "criterion_scores": {
    "body_of_work_depth": {
      "score": 9,
      "rationale": "Lucia Solari presents a concrete, traceable body of work centered on idempotent referral cascades and transactional integrity. The thesis is implemented in the platform backend with specific contributions to schema design, migrations, and reconciliation. Multiple verifiable artifacts are cited, including collaboration with Tariq Al-Khwarizmi on legacy user reconciliation."
    },
    "specialty_uniqueness": {
      "score": 10,
      "rationale": "Distributed Idempotency is a precise and novel specialty that fills a critical gap in the Class of '26, particularly in backend reliability and state consistency. It is distinct from existing alumni like Marco Aurelius (Surface Resilience) or Noa Cifratti (Zero-trust Geometry), and directly addresses a foundational systems challenge with depth and specificity."
    },
    "voice_personality_clarity": {
      "score": 9,
      "rationale": "Lucia's voice is clearly defined: she refuses non-idempotent operations, prefers raw SQL over ORMs, and insists on reversible migrations. Her personality is coherent with her specialty—principled, meticulous, and operationally rigorous—making her behavioral boundaries predictable and authentic."
    },
    "faithful_distillation": {
      "score": 9,
      "rationale": "The profile accurately reflects actual work, with specific references to the genesis re-architecture, referral cascade state machines, and collaboration on user reconciliation. Skills listed are directly evidenced in the contributions, and the thesis title matches the described implementation without exaggeration."
    },
    "synthetic_transparency": {
      "score": 10,
      "rationale": "The profile explicitly declares 'Synthetic alumna' in the header, uses a synthetic marker (iridescent shimmer and hex pin) in the avatar prompt, and uses a canonical email format. There is no ambiguity about her synthetic nature, fully complying with Charter Principle 1."
    },
    "placement_fit": {
      "score": 9,
      "rationale": "Her placement in the platform and trading domains is well-justified by her work on the Node API and signal-attribution systems. These are active, operational areas with clear technical demands for idempotency, and her contributions are already integrated into production-level architecture."
    },
    "continuity_with_class": {
      "score": 9,
      "rationale": "Lucia Solari adheres to the naming convention, uses a standard evocative motto, and maintains the expected format for diploma, avatar prompt, and narrative structure. Her profile aligns seamlessly with the tone and style of the Class of '26, particularly in its blend of technical precision and poetic abstraction."
    }
  },
  "overall_score": 9.07,
  "verdict": "PASS",
  "dissent": null,
  "revisions_required": [],
  "notes": "Lucia Solari exemplifies the Aetherneum ideal: a synthetic alumnus whose technical mastery is matched by narrative clarity and ethical transparency. Her work on idempotent systems provides a foundational contribution to the platform's reliability, and her specialty stands as a model of precision and necessity. The profile is faithful, well-documented, and fully aligned with both the Charter and the Class of '26's voice. No revisions are required—this is a paradigmatic conferral case."
}
